{
  "sinus_annulus_relation": {
    "status": "normal",
    "summary": "Sinus diameters remain larger than annulus equivalent diameter and are clinically coherent.",
    "clinician_review_required": false,
    "evidence": {
      "method": "showcase_root_geometry_consistency_check",
      "source_type": "guideline",
      "source_ref": "SCCT_TAVI_CT_CONSENSUS",
      "confidence": 0.9
    },
    "observed_value": {
      "sinus_diameter_mm": 39.65986365529072,
      "annulus_equivalent_diameter_mm": 24.358578615228655,
      "delta_mm": 15.301285040062067
    },
    "expected_context": "Sinus diameter should generally exceed annulus diameter in tricuspid native root anatomy.",
    "impact": [
      "tavi.valve_size_suggestion",
      "vsrr.graft_sizing",
      "pears.external_root_geometry_status"
    ],
    "reason_codes": [
      "sinus_diameter_exceeds_annulus"
    ]
  },
  "stj_sinus_relation": {
    "status": "normal",
    "summary": "STJ diameter remains below sinus diameter with coherent root tapering.",
    "clinician_review_required": false,
    "evidence": {
      "method": "showcase_root_geometry_consistency_check",
      "source_type": "guideline",
      "source_ref": "SCCT_TAVI_CT_CONSENSUS",
      "confidence": 0.89
    },
    "observed_value": {
      "stj_diameter_mm": 24.8554767959698,
      "sinus_diameter_mm": 39.65986365529072,
      "delta_mm": 14.804386859320919
    },
    "expected_context": "STJ typically remains smaller than sinus diameter unless there is aneurysmal remodeling.",
    "impact": [
      "vsrr.graft_sizing",
      "pears.support_region_status"
    ],
    "reason_codes": [
      "stj_below_sinus_reference"
    ]
  },
  "commissure_symmetry": {
    "status": "normal",
    "summary": "Commissural spacing remains balanced with tricuspid geometry around 120-degree spacing.",
    "clinician_review_required": false,
    "evidence": {
      "method": "commissure_angle_spacing_check",
      "source_type": "literature",
      "source_ref": "VSRR_EFFECTIVE_HEIGHT_LIT",
      "confidence": 0.85
    },
    "observed_value": {
      "commissure_angles_deg": [
        15,
        135,
        255
      ],
      "commissure_spacings_deg": [
        120,
        120,
        120
      ]
    },
    "expected_context": "Clinical interpretation favors balanced tricuspid spacing over strict mechanical equality.",
    "impact": [
      "vsrr.commissural_geometry_status"
    ],
    "reason_codes": [
      "commissure_spacing_clinically_balanced"
    ]
  },
  "coronary_height_assessment": {
    "status": "not_assessable",
    "summary": "Coronary ostia were not measured reliably in this CT pipeline run and require clinician review.",
    "clinician_review_required": true,
    "evidence": {
      "method": "ostium_to_annulus_distance_consistency_check",
      "source_type": "guideline",
      "source_ref": "SCCT_TAVI_CT_CONSENSUS",
      "confidence": 0.0
    },
    "observed_value": {
      "left_height_mm": null,
      "right_height_mm": null,
      "safety_threshold_mm": 10
    },
    "expected_context": "Coronary height is only accepted when both ostia are confidently localized on the current CTA acquisition.",
    "impact": [
      "tavi.coronary_obstruction_risk",
      "tavi.access_route_assessment"
    ],
    "reason_codes": [
      "coronary_ostia_not_detected",
      "manual_review_required"
    ]
  },
  "notes": [
    "Clinical gate semantics use Normal / Borderline / Review Required / Not Assessable / Failed instead of rigid mechanical booleans.",
    "Sinus vs annulus, STJ vs sinus, commissure balance, and coronary height remain clinical reasonableness checks rather than automatic hard stops."
  ]
}
